universite de caen normandie,university caen normandy
universite de strasbourg,university strasbourg
universite claude bernard lyon 1,claude bernard university lyon 1
universite de nice sophia antipolis,university nice sophia antipolis
universite paris 1 pantheon sorbonne,university paris 1 pantheon sorbonne
universite paris sud,paris sud university
ecole normale superieure,normal superior school
universite de bordeaux,university bordeaux
universite de rennes 1,university rennes 1
universite pierre et marie curie,pierre and marie curie university
universite de poitiers,university poitiers
universite paris 8 vincennes saint denis,university paris 8
universite de lorraine,university lorraine
ecole polytechnique,polytechnic school
universite paris diderot,paris diderot university
universite de montpellier,university montpellier
ecole des hautes etudes en sciences sociales,school for advanced studies in the social sciences
universite charles de gaulle lille 3,charles de gaulle university lille 3
mines paristech,national graduate school engineering paris
universite de nantes,university nantes
universite joseph fourier,joseph fourier university
universite paris descartes,paris descartes university
universite de technologie de compiegne,university technology compiegne
universite paris sorbonne,paris sorbonne university
universite lille 1 sciences et technologies,lille 1 university science and technology
ecole normale superieure de lyon,normal superior school lyon
universite de la sorbonne nouvelle paris 3,new sorbonne university paris iii
universite de bourgogne,university burgundy
universite paul valery montpellier 3,paul valery university montpellier 3
universite d angers,university angers
universite de franche comte,university franche comte
universite toulouse jean jaures,jean jaures university toulouse
universite paris est creteil val de marne,paris est creteil val de marne university
ecole centrale paris,central school paris
universite paris ouest nanterre la defense,paris west university nanterre la defense
universite de rouen,university rouen
universite paris dauphine,paris dauphine university
universite lumiere lyon 2,lumiere university lyon 2
universite francois rabelais,francois rabelais university
universite paris 13,paris 13 university
institut polytechnique de grenoble,grenoble institute technology
universite toulouse iii paul sabatier,paul sabatier university toulouse iii
aix marseille universite,university aix marseilles
universite de reims champagne ardenne,university rheims champagne ardenne
institut national des sciences appliquees de lyon,national institute for applied sciences lyon
institut d etudes politiques de paris,paris institute political studies
universite d orleans,university orleans
universite du maine,university maine
universite de limoges,university limoges
universite de picardie jules verne,university picardie jules verne
ecole centrale de lyon,central school lyon
ecole superieure des sciences economiques et commerciales,essec business school paris
universite de versailles saint quentin en yvelines,versailles saint quentin en yvelines university
universite rennes 2,university rennes 2
ecole des hautes etudes commerciales,hec school management
universite de bretagne occidentale,university western brittany
universite de haute alsace,upper alsace university
universite de pau et des pays de l adour,university pau and pays de l adour
universite pantheon assas paris ii,pantheon assas paris ii university
universite blaise pascal,blaise pascal university
universite savoie mont blanc,university savoy mont blanc
ecole normale superieure de cachan,normal superior school cachan
universite d avignon et des pays de vaucluse,university avignon and the vaucluse
universite lille 2 droit et sante,lille 2 university health and law
universite pierre mendes france,pierre mendes france university
universite toulouse 1 capitole,toulouse 1 university capitole
universite jean moulin lyon 3,jean moulin university lyon 3
grenoble ecole de management,grenoble graduate school business
universite jean monnet saint etienne,jean monnet university saint etienne
universite de cergy pontoise,cergy pontoise university
ecole des ponts paristech,national school bridges and roads
universite de perpignan via domitia,university perpignan via domitia
universite de toulon,university toulon
ecole nationale superieure des sciences de l information et des bibliotheques,national school library and information science
universite de valenciennes et du hainaut cambresis,university valenciennes and hainaut cambresis
universite bordeaux montaigne,bordeaux montaigne university
arts et metiers paristech,national advanced school engineering
ecole centrale de lille,central school lille
ecole superieure d electricite,graduate school electrical engineering
agroparistech,paris institute technology for life food and environmental sciences
universite du littoral cote d opale,university the littoral opal coast
ecole nationale superieure des mines de st etienne,national graduate school engineering st etienne
espci paristech,school industrial physics and chemistry paris
universite de corse pascal paoli,university corsica pascal paoli
ecole des hautes etudes en sante publique,ehesp school public health
universite d artois,artois university
universite de la rochelle,university la rochelle
universite de bretagne sud,university southern brittany
universite paris est marne la vallee,university paris est marne la vallee
universite d evry val d essonne,university evry val d essonne
universite stendhal grenoble 3,stendhal university grenoble 3
universite du havre,university le havre
ecole nationale veterinaire d alfort,national veterinary school alfort
universite d auvergne,university auvergne
institut catholique de paris,catholic university paris
universite de technologie de troyes,university technology troyes
ecole nationale d administration,national school public administration
universite de technologie de belfort montbeliard,university technology belfort montbeliard
institut national des sciences appliquees de toulouse,national institute for applied sciences toulouse
ecole pour l informatique et les techniques avancees,graduate school computer science and advanced technologies
ecole des mines d albi carmaux,albi carmaux school engineering
universite catholique de lille,lille catholic university
ecole nationale superieure d ingenieurs de caen,national graduate school engineering caen
ecole nationale de l aviation civile,national school civil aviation
ensta paristech,national graduate school for advanced technologies
ecole nationale superieure de l electronique et de ses applications,ensea graduate school
audencia nantes ecole de management,audencia nantes school management
institut national des sciences appliquees de strasbourg,national institute for applied sciences strasbourg
ecole superieure des sciences commerciales d angers,angers graduate school business
ecole des mines d ales,ales school engineering
institut national polytechnique de toulouse,national polytechnic institute toulouse
groupe icn ecole de management,icn business school
ecole de management de normandie,normandy business school
ecole centrale de nantes,central school nantes
ecole superieure d informatique electronique automatique,graduate school information technology electronics automation
ecole speciale des travaux publics du batiment et de l industrie,special school for public works building and industry
universite catholique de l ouest,catholic university the west
l ecole de design nantes atlantique,nantes atlantique school design
universite de nimes,university nimes
ece paris ecole d ingenieurs,ece paris graduate school engineering
ecole nationale superieure de chimie de rennes,national graduate school chemistry rennes
institut national des sciences appliquees de rouen,national institute for applied sciences rouen
ecole nationale superieure de chimie de montpellier,national graduate school chemistry montpellier
ecole des mines de nantes,nantes school engineering
ecole d ingenieurs des technologies de l information et de la communication,engineering school information technology and communication
ecole nationale des travaux publics de l etat,national school public civil engineering
universite catholique de lyon,catholic university lyon
ecole superieure de chimie physique electronique de lyon,graduate school chemistry physics and electronics lyon
inseec alpes savoie,graduate school management chambery
institut national superieur des sciences agronomiques de l alimentation et de l environnement,higher national institute agricultural science food and environment
ecole normale superieure de rennes,normal superior school rennes
institut superieur de l aeronautique et de l espace,higher institute aeronautics and space
institut national universitaire champollion,champollion national university institute
ecole superieure de commerce de dijon,burgundy school business
institut d optique graduate school,the institute optics graduate school
institut national des sciences appliquees de rennes,national institute for applied sciences rennes
ecole superieure d agriculture d angers,graduate school agricultural studies angers
ecole superieure d ingenieurs en genie electrique,graduate school electrical engineering
institut superieur d electronique de paris,graduate school engineers in paris
ecole nationale veterinaire de toulouse,national veterinary school toulouse
hautes etudes d ingenieur,school advanced engineering studies
ecole des mines de douai,douai school engineering
ecole catholique d arts et metiers,catholic school engineering
ecole superieure des techniques aeronautiques et de construction automobile,graduate school aeronautical and automotive engineering
ecole centrale de marseille,central school marseille
ecole superieure d electronique de l ouest,graduate school electronics the west
ecole nationale d ingenieurs de brest,brest national school engineering
epf ecole d ingenieurs,epf college engineering
ecole nationale des sciences geographiques,national school geographic sciences
ecole nationale superieure des arts et industries textiles,national graduate school textile engineering
ecole internationale des sciences du traitement de l information,international school information processing science
ecole nationale superieure de mecanique et d aerotechnique,national engineering school mechanical and aeronautical engineering
institut polytechnique lasalle beauvais,polytechnic institute lasalle beauvais
ensae paristech,national school statistics and economic administration
ecole des ingenieurs de la ville de paris,paris school engineering
ecole nationale superieure de chimie de lille,national graduate school chemistry lille
institut polytechnique de bordeaux,bordeaux polytechnic institute
ecole superieure des technologies industrielles avancees,graduate school advanced industrial technologies
ecole nationale d ingenieurs de saint etienne,national school engineering saint etienne
icam institut catholiques d arts et metiers,icam catholic institute engineering
ecole nationale d ingenieurs de metz,metz national school engineering
ecole nationale veterinaire agroalimentaire et de l alimentation de nantes atlantique,national school engineering in agricultural and food industries
institut francais de mecanique avancee,french institute advanced mechanics
ecole nationale superieure d architecture de nancy,national school architecture nancy
supmeca institut superieur de mecanique,supmeca higher institute mechanical engineering
ecole nationale superieure de techniques avancees bretagne,national institute advanced technology
ecole nationale de la statistique et de l analyse de l information,national school statistics and information analysis
institut polytechnique des sciences avancees,polytechnic institute advanced science
ecole nationale superieure des sciences agronomiques de bordeaux aquitaine,national school agricultural sciences bordeaux aquitaine
ecole nationale de la meteorologie,national school meteorological studies
ecole nationale d ingenieurs de tarbes,national school engineering tarbes
esme sudria,school engineering innovation energy and advanced technologies
ecole nationale superieure de chimie de paris,national graduate school chemistry paris
ecole d ingenieurs generalistes la rochelle,la rochelle engineering school
ecole superieure de commerce de pau,business school esc pau
institut catholique de toulouse,catholic institute toulouse
institut superieur d electronique et du numerique,higher institute electronics and digital studies
ecole nationale superieure d informatique pour l industrie et l entreprise,national school computer science for industry and business
groupe isa,isa group
ecole nationale superieure de mecaniques et des microtechniques,national engineering graduate school mechanics and microtechnologies
institut textile et chimique de lyon,textile and chemical institute lyon
ecole d ingenieurs de purpan,purpan engineering school
ecole superieure de commerce de saint etienne,graduate school management saint etienne
ecole superieure d ingenieurs leonard de vinci,graduate school engineers leonardo da vinci
ecole nationale superieure agronomique de toulouse,national graduate school agronomy toulouse
ecole louis de broglie,louis de broglie school
institut superieur d agriculture et d agroalimentaire rhone alpes,institute for agriculture and food industry rhone alpes
ecole superieure angevine d informatique et de productique,graduate school information technology angers
ecole superieure d ingenieurs en informatique et genie des telecommunications,graduate school engineers in computer science and telecommunications
esitpa ecole d ingenieurs en agriculture,esitpa school agricultural engineering
ecole superieure du bois,graduate school bois
ecole nationale superieure de chimie de clermont ferrand,national graduate school chemistry clermont ferrand
3il ecole d ingenieurs,3il school engineering
institut superieur des materiaux et mecaniques avances du mans,higher institute materials and advanced mechanics le mans
ecole superieure de chimie organique et minerale,graduate school organic and mineral chemistry
ecole nationale superieure de ceramique industrielle,national engineering college for industrial ceramics
campus adventiste du saleve,adventist university france
ecole de biologie industrielle,school industrial biology
ecole nationale superieure de la nature et du paysage,national school nature and landscape
ecole superieure d agro developpement international,graduate school international agro development
institut national des sciences appliquees centre val de loire,national institute applied sciences centre val de loire
ecole des metiers de l environnement,environmental management and engineering school
ecole superieure d ingenieurs des travaux de la construction de caen,graduate school building engineering caen
ecam epmi,ecam epmi graduate school engineering
ecole superieure d ingenieurs des travaux de la construction de cachan,graduate school building engineering cachan
ecole superieure d ingenieurs des travaux de la construction de metz,graduate school building engineering metz
institut superieur du batiment et des travaux publics,higher institute buildings and public works
eil cote d opale,pas de calais engineering school
ecole superieure de fonderie et de forge,graduate school foundry and forge
