universitat wien,university vienna
technische universitat wien,vienna university technology
universitat innsbruck,university innsbruck
technische universitat graz,graz university technology
universitat graz,university graz
universitat salzburg,university salzburg
universitat fur bodenkultur wien,university natural resources and applied life sciences vienna
wirtschaftsuniversitat wien,vienna university economics and business
alpen adria universitat klagenfurt,alps adriatic university klagenfurt
johannes kepler universitat linz,johannes kepler university linz
medizinische universitat wien,medical university vienna
medizinische universitat graz,medical university graz
donau universitat krems,danube university krems
montanuniversitat leoben,university leoben
fh oberosterreich,university applied sciences upper austria
veterinarmedizinische universitat wien,university veterinary medicine vienna
universitat fur musik und darstellende kunst wien,university music and performing arts vienna
fachhochschule technikum wien,university applied sciences technikum wien
fachhochschule salzburg,salzburg university applied sciences
universitat mozarteum salzburg,mozarteum university salzburg
medizinische universitat innsbruck,innsbruck medical university
universitat fur musik und darstellende kunst graz,university music and performing arts graz
universitat fur kunstlerische und industrielle gestaltung linz,university arts and industrial design linz
fachhochschule campus wien,fh campus wien university applied sciences
akademie der bildenden kunste wien,academy fine arts vienna
fachhochschule karnten,carinthia university applied sciences
fachhochschule st polten,st polten university applied sciences
fachhochschule vorarlberg,vorarlberg university applied sciences
universitat fur angewandte kunst wien,university applied arts vienna
fachhochschule kufstein tirol,kufstein university applied sciences
fachhochschulstudiengange burgenland,burgenland university applied sciences
campus 02 fachhochschule der wirtschaft,campus 02 university applied sciences
private universitat fur gesundheitswissenschaften medizinische informatik und technik,university for health sciences medical informatics and technology
fachhochschule wiener neustadt,university applied sciences wiener neustadt
fachhochschule des bfi wien,university applied sciences bfi vienna
paracelsus medizinische privatuniversitat,paracelsus medical university
imc fachhochschule krems,imc university applied sciences in krems
padagogische hochschule niederosterreich,university college teacher education lower austria
anton bruckner privatuniversitat,anton bruckner private university
sigmund freud privatuniversitat wien,sigmund freud private university vienna
kirchliche padagogische hochschule wien krems,university college teacher education vienna krems
padagogische hochschule oberosterreich,university college education upper austria
musik und kunst privatuniversitat der stadt wien,private university vienna for music and arts
katholisch theologische privatuniversitat linz,catholic theological university linz
padagogische hochschule steiermark,steiermark university education
private padagogische hochschule der diozese linz,private university college the diocese linz
hochschule fur agrar und umweltpadagogik,university college for agrarian and environmental pedagogy
kirchliche padagogische hochschule graz,catholic university college for education graz
privatuniversitat der kreativwirtschaft,new design private university
padagogische hochschule salzburg,university education salzburg
padagogische hochschule karnten,university college teacher education carinthia
padagogische hochschule tirol,pedagogical university tyrol
padagogische hochschule vorarlberg,vorarlberg university education
kirchliche padagogische hochschule edith stein,church college education edith stein
privatuniversitat schloss seeburg,private university seeburg castle
padagogische hochschule wien,vienna university education
diplomatische akademie wien,diplomatic academy vienna
karl landsteiner privatuniversitat fur gesundheitswissenschaften,karl landsteiner private university for health sciences
